{"productKey":"doji-nhan","range":"1y","kind":"daily","points":[{"day":"2026-06-11","buy":{"open":133400000,"high":133400000,"low":133400000,"close":133400000},"sell":{"open":138400000,"high":138400000,"low":138400000,"close":138400000},"spreadAvg":5000000},{"day":"2026-06-12","buy":{"open":143000000,"high":143000000,"low":136500000,"close":142500000},"sell":{"open":146000000,"high":146000000,"low":141500000,"close":145500000},"spreadAvg":3170886},{"day":"2026-06-13","buy":{"open":144000000,"high":144000000,"low":144000000,"close":144000000},"sell":{"open":147000000,"high":147000000,"low":147000000,"close":147000000},"spreadAvg":3000000},{"day":"2026-06-15","buy":{"open":148500000,"high":148500000,"low":147000000,"close":148000000},"sell":{"open":151000000,"high":151000000,"low":149500000,"close":150500000},"spreadAvg":2500000},{"day":"2026-06-16","buy":{"open":148500000,"high":150000000,"low":148500000,"close":150000000},"sell":{"open":151000000,"high":152000000,"low":151000000,"close":152000000},"spreadAvg":2081250},{"day":"2026-06-17","buy":{"open":149000000,"high":150000000,"low":149000000,"close":150000000},"sell":{"open":151500000,"high":152000000,"low":151500000,"close":152000000},"spreadAvg":2243750},{"day":"2026-06-18","buy":{"open":147500000,"high":149000000,"low":147300000,"close":149000000},"sell":{"open":150500000,"high":151500000,"low":150300000,"close":151500000},"spreadAvg":2693750},{"day":"2026-06-19","buy":{"open":143500000,"high":144800000,"low":142500000,"close":143700000},"sell":{"open":146500000,"high":147800000,"low":146500000,"close":146700000},"spreadAvg":3600000},{"day":"2026-06-20","buy":{"open":144200000,"high":144200000,"low":144200000,"close":144200000},"sell":{"open":147200000,"high":147200000,"low":147200000,"close":147200000},"spreadAvg":3000000},{"day":"2026-06-22","buy":{"open":145600000,"high":145700000,"low":145000000,"close":145000000},"sell":{"open":148600000,"high":148700000,"low":148000000,"close":148000000},"spreadAvg":3000000},{"day":"2026-06-23","buy":{"open":144000000,"high":145000000,"low":144000000,"close":144800000},"sell":{"open":147000000,"high":148000000,"low":147000000,"close":147800000},"spreadAvg":3000000},{"day":"2026-06-24","buy":{"open":144000000,"high":145000000,"low":144000000,"close":144000000},"sell":{"open":147000000,"high":148000000,"low":147000000,"close":147000000},"spreadAvg":3000000},{"day":"2026-06-25","buy":{"open":143000000,"high":143000000,"low":143000000,"close":143000000},"sell":{"open":146000000,"high":146000000,"low":146000000,"close":146000000},"spreadAvg":3000000},{"day":"2026-06-26","buy":{"open":143000000,"high":144000000,"low":143000000,"close":143000000},"sell":{"open":146500000,"high":147000000,"low":146000000,"close":146000000},"spreadAvg":3030864},{"day":"2026-06-27","buy":{"open":145500000,"high":145500000,"low":145500000,"close":145500000},"sell":{"open":148500000,"high":148500000,"low":148500000,"close":148500000},"spreadAvg":3000000},{"day":"2026-06-29","buy":{"open":145000000,"high":145000000,"low":145000000,"close":145000000},"sell":{"open":148000000,"high":148000000,"low":148000000,"close":148000000},"spreadAvg":3000000},{"day":"2026-06-30","buy":{"open":144000000,"high":144000000,"low":143000000,"close":143000000},"sell":{"open":147000000,"high":147000000,"low":146000000,"close":146000000},"spreadAvg":3000000},{"day":"2026-07-01","buy":{"open":143400000,"high":143400000,"low":143400000,"close":143400000},"sell":{"open":146400000,"high":146400000,"low":146400000,"close":146400000},"spreadAvg":3000000},{"day":"2026-07-02","buy":{"open":145400000,"high":145400000,"low":145400000,"close":145400000},"sell":{"open":148400000,"high":148400000,"low":148400000,"close":148400000},"spreadAvg":3000000},{"day":"2026-07-03","buy":{"open":148400000,"high":148400000,"low":148400000,"close":148400000},"sell":{"open":151400000,"high":151400000,"low":151400000,"close":151400000},"spreadAvg":3000000},{"day":"2026-07-04","buy":{"open":148400000,"high":148400000,"low":148400000,"close":148400000},"sell":{"open":151400000,"high":151400000,"low":151400000,"close":151400000},"spreadAvg":3000000},{"day":"2026-07-06","buy":{"open":148000000,"high":148400000,"low":148000000,"close":148400000},"sell":{"open":151000000,"high":151400000,"low":151000000,"close":151400000},"spreadAvg":3000000},{"day":"2026-07-07","buy":{"open":147000000,"high":147500000,"low":147000000,"close":147500000},"sell":{"open":150000000,"high":150500000,"low":150000000,"close":150500000},"spreadAvg":3000000},{"day":"2026-07-08","buy":{"open":145500000,"high":146500000,"low":145500000,"close":146500000},"sell":{"open":148500000,"high":149500000,"low":148500000,"close":149500000},"spreadAvg":3000000},{"day":"2026-07-09","buy":{"open":145300000,"high":145500000,"low":144300000,"close":144300000},"sell":{"open":149300000,"high":149300000,"low":148300000,"close":148300000},"spreadAvg":3975309},{"day":"2026-07-10","buy":{"open":146000000,"high":146000000,"low":145000000,"close":145000000},"sell":{"open":149500000,"high":149500000,"low":149000000,"close":149000000},"spreadAvg":3906250},{"day":"2026-07-13","buy":{"open":144000000,"high":144000000,"low":143000000,"close":143000000},"sell":{"open":148000000,"high":148000000,"low":146800000,"close":146800000},"spreadAvg":3817284},{"day":"2026-07-14","buy":{"open":143000000,"high":143000000,"low":143000000,"close":143000000},"sell":{"open":146500000,"high":146500000,"low":146500000,"close":146500000},"spreadAvg":3500000},{"day":"2026-07-15","buy":{"open":143500000,"high":143500000,"low":143500000,"close":143500000},"sell":{"open":147500000,"high":147500000,"low":147500000,"close":147500000},"spreadAvg":4000000},{"day":"2026-07-16","buy":{"close":148400000},"sell":{"close":151400000}},{"day":"2026-07-17","buy":{"close":148200000},"sell":{"close":151200000}},{"day":"2026-07-18","buy":{"close":148200000},"sell":{"close":151200000}},{"day":"2026-07-19","buy":{"close":148200000},"sell":{"close":151200000}},{"day":"2026-07-20","buy":{"close":148200000},"sell":{"close":151200000}},{"day":"2026-07-21","buy":{"close":148200000},"sell":{"close":151200000}},{"day":"2026-07-22","buy":{"close":148200000},"sell":{"close":151200000}},{"day":"2026-07-23","buy":{"close":148200000},"sell":{"close":151200000}},{"day":"2026-07-24","buy":{"close":148200000},"sell":{"close":151200000}},{"day":"2026-07-25","buy":{"close":148200000},"sell":{"close":151200000}},{"day":"2026-07-26","buy":{"close":148200000},"sell":{"close":151200000}},{"day":"2026-07-27","buy":{"close":148200000},"sell":{"close":151200000}},{"day":"2026-07-28","buy":{"close":148200000},"sell":{"close":151200000}},{"day":"2026-07-29","buy":{"close":148200000},"sell":{"close":151200000}},{"day":"2026-07-30","buy":{"close":148200000},"sell":{"close":151200000}},{"day":"2026-07-31","buy":{"close":148200000},"sell":{"close":151200000}},{"day":"2026-08-01","buy":{"close":148200000},"sell":{"close":151200000}},{"day":"2026-08-02","buy":{"close":148200000},"sell":{"close":151200000}},{"day":"2026-08-03","buy":{"close":148200000},"sell":{"close":151200000}},{"day":"2026-08-04","buy":{"close":148200000},"sell":{"close":151200000}},{"day":"2026-08-05","buy":{"close":148200000},"sell":{"close":151200000}},{"day":"2026-08-06","buy":{"close":148200000},"sell":{"close":151200000}},{"day":"2026-08-07","buy":{"close":148200000},"sell":{"close":151200000}},{"day":"2026-08-08","buy":{"close":148200000},"sell":{"close":151200000}},{"day":"2026-08-09","buy":{"close":148200000},"sell":{"close":151200000}},{"day":"2026-08-10","buy":{"close":148200000},"sell":{"close":151200000}},{"day":"2026-08-11","buy":{"close":148200000},"sell":{"close":151200000}},{"day":"2026-08-12","buy":{"close":148200000},"sell":{"close":151200000}},{"day":"2026-08-13","buy":{"close":148200000},"sell":{"close":151200000}},{"day":"2026-08-14","buy":{"close":148200000},"sell":{"close":151200000}},{"day":"2026-08-15","buy":{"close":148200000},"sell":{"close":151200000}},{"day":"2026-08-16","buy":{"close":148200000},"sell":{"close":151200000}},{"day":"2026-08-17","buy":{"close":148200000},"sell":{"close":151200000}},{"day":"2026-08-18","buy":{"close":148200000},"sell":{"close":151200000}},{"day":"2026-08-19","buy":{"close":148200000},"sell":{"close":151200000}},{"day":"2026-08-20","buy":{"close":148200000},"sell":{"close":151200000}},{"day":"2026-08-21","buy":{"open":143000000,"high":144000000,"low":143000000,"close":144000000},"sell":{"open":147000000,"high":148000000,"low":147000000,"close":148000000},"spreadAvg":4000000},{"day":"2026-08-22","buy":{"open":144000000,"high":145500000,"low":144000000,"close":145500000},"sell":{"open":148000000,"high":149500000,"low":148000000,"close":149500000},"spreadAvg":4000000},{"day":"2026-08-23","buy":{"open":145500000,"high":145500000,"low":145500000,"close":145500000},"sell":{"open":149500000,"high":149500000,"low":149500000,"close":149500000},"spreadAvg":4000000},{"day":"2026-08-24","buy":{"open":145500000,"high":149000000,"low":145500000,"close":149000000},"sell":{"open":149500000,"high":153000000,"low":149500000,"close":153000000},"spreadAvg":4000000},{"day":"2026-08-25","buy":{"open":149000000,"high":152000000,"low":149000000,"close":150000000},"sell":{"open":153000000,"high":156000000,"low":153000000,"close":154000000},"spreadAvg":4000000},{"day":"2026-08-26","buy":{"open":150000000,"high":150000000,"low":149800000,"close":149800000},"sell":{"open":154000000,"high":154000000,"low":153800000,"close":153800000},"spreadAvg":4000000},{"day":"2026-08-27","buy":{"open":149800000,"high":149800000,"low":148000000,"close":148000000},"sell":{"open":153800000,"high":153800000,"low":152000000,"close":152000000},"spreadAvg":4000000},{"day":"2026-08-28","buy":{"open":148000000,"high":148000000,"low":147500000,"close":147700000},"sell":{"open":152000000,"high":152000000,"low":151500000,"close":151700000},"spreadAvg":4000000},{"day":"2026-08-29","buy":{"open":147700000,"high":147700000,"low":145700000,"close":145700000